{"bundle_id":"sebv1:sha256:8980bd6a644ee976f055f55724712f2d4b6c20e29dd8a017568e0cdf07b4a991","captured_timestamps":[{"artifact_id":null,"event_kind":"ACTION_MARKER","recorder_observed_at":"2026-07-19T12:00:04Z","recorder_offset_ns":4000000000,"source_id":null,"source_observed_at":null},{"artifact_id":null,"event_kind":"SOURCE_ACQUISITION_START","recorder_observed_at":"2026-07-19T12:00:01.1Z","recorder_offset_ns":1100000000,"source_id":"ebus-11111111111111111111111111111111","source_observed_at":null},{"artifact_id":null,"event_kind":"SOURCE_ACQUISITION_END","recorder_observed_at":"2026-07-19T12:00:01.2Z","recorder_offset_ns":1200000000,"source_id":"ebus-11111111111111111111111111111111","source_observed_at":null},{"artifact_id":null,"event_kind":"SOURCE_ACQUISITION_START","recorder_observed_at":"2026-07-19T12:00:01.5Z","recorder_offset_ns":1500000000,"source_id":"eebus-44444444444444444444444444444444","source_observed_at":null},{"artifact_id":null,"event_kind":"SOURCE_ACQUISITION_END","recorder_observed_at":"2026-07-19T12:00:02.5Z","recorder_offset_ns":2500000000,"source_id":"eebus-44444444444444444444444444444444","source_observed_at":null},{"artifact_id":null,"event_kind":"SOURCE_ACQUISITION_START","recorder_observed_at":"2026-07-19T12:00:03.1Z","recorder_offset_ns":3100000000,"source_id":"ebus-22222222222222222222222222222222","source_observed_at":null},{"artifact_id":null,"event_kind":"SOURCE_ACQUISITION_END","recorder_observed_at":"2026-07-19T12:00:03.2Z","recorder_offset_ns":3200000000,"source_id":"ebus-22222222222222222222222222222222","source_observed_at":null},{"artifact_id":null,"event_kind":"SOURCE_ACQUISITION_START","recorder_observed_at":"2026-07-19T12:00:04.5Z","recorder_offset_ns":4500000000,"source_id":"cloud-55555555555555555555555555555555","source_observed_at":null},{"artifact_id":null,"event_kind":"SOURCE_ACQUISITION_END","recorder_observed_at":"2026-07-19T12:00:04.6Z","recorder_offset_ns":4600000000,"source_id":"cloud-55555555555555555555555555555555","source_observed_at":null},{"artifact_id":null,"event_kind":"SOURCE_ACQUISITION_START","recorder_observed_at":"2026-07-19T12:00:06.1Z","recorder_offset_ns":6100000000,"source_id":"ebus-33333333333333333333333333333333","source_observed_at":null},{"artifact_id":null,"event_kind":"SOURCE_ACQUISITION_END","recorder_observed_at":"2026-07-19T12:00:06.2Z","recorder_offset_ns":6200000000,"source_id":"ebus-33333333333333333333333333333333","source_observed_at":null},{"artifact_id":"seav1:sha256:02e77d04afd1d96df8c24abd527726dae82316ed30703f8a72a19d3e578deb48","event_kind":"ARTIFACT_INGESTION","recorder_observed_at":"2026-07-19T12:00:01.25Z","recorder_offset_ns":1250000000,"source_id":"ebus-11111111111111111111111111111111","source_observed_at":"2026-07-19T11:59:59Z"},{"artifact_id":"seav1:sha256:56010d38b1c7217461f5b843509ac4c6a8ee029a3ea1fac958b8e2eb56101d3b","event_kind":"ARTIFACT_INGESTION","recorder_observed_at":"2026-07-19T12:00:02.75Z","recorder_offset_ns":2750000000,"source_id":"eebus-44444444444444444444444444444444","source_observed_at":"2026-07-19T12:00:02Z"},{"artifact_id":"seav1:sha256:2b4dd42381a84888d9db61696e07fe1cd435aa591ce46e106346abb3c6a997fd","event_kind":"ARTIFACT_INGESTION","recorder_observed_at":"2026-07-19T12:00:03.25Z","recorder_offset_ns":3250000000,"source_id":"ebus-22222222222222222222222222222222","source_observed_at":"2026-07-19T12:00:02Z"},{"artifact_id":"seav1:sha256:8b96127c3059945ba940f03facfa0dfa102af622300d6e767ff73fadab9acf80","event_kind":"ARTIFACT_INGESTION","recorder_observed_at":"2026-07-19T12:00:04.65Z","recorder_offset_ns":4650000000,"source_id":"cloud-55555555555555555555555555555555","source_observed_at":"2026-07-19T11:59:58Z"},{"artifact_id":"seav1:sha256:3fc5855236ac147a00fc0a9ab53f6bff7c2c7cd0013699141e680f5235e76101","event_kind":"ARTIFACT_INGESTION","recorder_observed_at":"2026-07-19T12:00:06.25Z","recorder_offset_ns":6250000000,"source_id":"ebus-33333333333333333333333333333333","source_observed_at":"2026-07-19T12:00:05Z"}],"contract":"helianthus.platform.synchronized-evidence-replay.v1","future_candidate_inputs":[{"artifact_id":"seav1:sha256:02e77d04afd1d96df8c24abd527726dae82316ed30703f8a72a19d3e578deb48","evidence_refs":[{"commit":null,"digest":"sha256:2222222222222222222222222222222222222222222222222222222222222222","digest_algorithm":"SHA256_CONTENT_BYTES","kind":"CONTENT","path":null,"repository":null}],"redacted_hash":"sha256:02e77d04afd1d96df8c24abd527726dae82316ed30703f8a72a19d3e578deb48","source_binding":{"auth_scope":{"authority":"effective","permissions":["ebus.read"]},"capture_window":{"action":{"end_offset_ns":6000000000,"evidence_ref":{"commit":null,"digest":"sha256:1111111111111111111111111111111111111111111111111111111111111111","digest_algorithm":"SHA256_CONTENT_BYTES","kind":"CONTENT","path":null,"repository":null},"marker_captured_at":"2026-07-19T12:00:04Z","marker_id":"marker-99999999999999999999999999999999","marker_offset_ns":4000000000,"start_offset_ns":3000000000},"post":{"end_offset_ns":9000000000,"start_offset_ns":6000000000},"pre":{"end_offset_ns":3000000000,"start_offset_ns":1000000000}},"ebus_identity":{"evidence_role":"AUTHORITATIVE","family":"B509","register_family":"system","register_id":512,"target_address":8,"target_product":"BAI00","target_pseudonym":"target-aaaaaaaaaaaaaaaaaaaaaaaaaaaaaaaa","unit_scale_source":"gateway-catalog-v1"},"mask_tier":"redacted","operation_id":"ebus.v1.snapshot.capture","operation_version":"git:520b6439441cb6e8ef9ff291bde28f4efa4db254","owner_commit":"e1962c0dc83836b0dbea129d198c7be6bea738da","owner_path":"protocols/vaillant/ebus-vaillant-B509.md","owner_repository":"Project-Helianthus/helianthus-docs-ebus","request_scope":{"operation_scope":"ebus-b509","phase":"pre","source_kind":"EBUS"},"runtime_kind":"EBUS","runtime_pseudonym":"runtime-11111111111111111111111111111111","schema_sha256":"dbe91a10a208613183f890849c634f8d13661194aad937a03ae2a4143070bf2d","snapshot_scope":{"mode":"SNAPSHOT","selector":"ebus-b509"},"source_contract":"helianthus.ebus.b509.evidence.v1","source_kind":"EBUS_B509","source_schema_version":1},"source_id":"ebus-11111111111111111111111111111111"},{"artifact_id":"seav1:sha256:56010d38b1c7217461f5b843509ac4c6a8ee029a3ea1fac958b8e2eb56101d3b","evidence_refs":[{"commit":null,"digest":"sha256:5555555555555555555555555555555555555555555555555555555555555555","digest_algorithm":"SHA256_CONTENT_BYTES","kind":"CONTENT","path":null,"repository":null}],"redacted_hash":"sha256:56010d38b1c7217461f5b843509ac4c6a8ee029a3ea1fac958b8e2eb56101d3b","source_binding":{"auth_scope":{"authority":"effective","permissions":["eebus.raw.read"]},"capture_window":{"action":{"end_offset_ns":6000000000,"evidence_ref":{"commit":null,"digest":"sha256:1111111111111111111111111111111111111111111111111111111111111111","digest_algorithm":"SHA256_CONTENT_BYTES","kind":"CONTENT","path":null,"repository":null},"marker_captured_at":"2026-07-19T12:00:04Z","marker_id":"marker-99999999999999999999999999999999","marker_offset_ns":4000000000,"start_offset_ns":3000000000},"post":{"end_offset_ns":9000000000,"start_offset_ns":6000000000},"pre":{"end_offset_ns":3000000000,"start_offset_ns":1000000000}},"ebus_identity":null,"mask_tier":"redacted","operation_id":"eebus.v1.features.data.get","operation_version":"git:1a02388170a1ee6befeed1529956a7104aa94e21","owner_commit":"a09e3a77153204bc3117e233c71e77ef1859834e","owner_path":"api/_candidate/msp-0625/helianthus.eebus.m625.public-redacted-evidence.v1.schema.json","owner_repository":"Project-Helianthus/helianthus-docs-eebus","request_scope":{"operation_scope":"feature-data","phase":"pre","source_kind":"EEBUS"},"runtime_kind":"EEBUS","runtime_pseudonym":"runtime-44444444444444444444444444444444","schema_sha256":"0a2885d01d6703389541e246db59bcd845a332e7ed296abca2d49b4f8de31811","snapshot_scope":{"mode":"LIVE_READ","selector":"feature-data"},"source_contract":"helianthus.eebus.m625.public-redacted-evidence.v1","source_kind":"EEBUS","source_schema_version":1},"source_id":"eebus-44444444444444444444444444444444"},{"artifact_id":"seav1:sha256:2b4dd42381a84888d9db61696e07fe1cd435aa591ce46e106346abb3c6a997fd","evidence_refs":[{"commit":null,"digest":"sha256:3333333333333333333333333333333333333333333333333333333333333333","digest_algorithm":"SHA256_CONTENT_BYTES","kind":"CONTENT","path":null,"repository":null}],"redacted_hash":"sha256:2b4dd42381a84888d9db61696e07fe1cd435aa591ce46e106346abb3c6a997fd","source_binding":{"auth_scope":{"authority":"effective","permissions":["ebus.read"]},"capture_window":{"action":{"end_offset_ns":6000000000,"evidence_ref":{"commit":null,"digest":"sha256:1111111111111111111111111111111111111111111111111111111111111111","digest_algorithm":"SHA256_CONTENT_BYTES","kind":"CONTENT","path":null,"repository":null},"marker_captured_at":"2026-07-19T12:00:04Z","marker_id":"marker-99999999999999999999999999999999","marker_offset_ns":4000000000,"start_offset_ns":3000000000},"post":{"end_offset_ns":9000000000,"start_offset_ns":6000000000},"pre":{"end_offset_ns":3000000000,"start_offset_ns":1000000000}},"ebus_identity":{"GG":3,"II":0,"RR":28,"family":"B524","group_meaning":"zones","instance_gate":"index-not-ff","opcode":2,"register_category":"STATE","source_address":247,"target_address":21,"target_pseudonym":"target-bbbbbbbbbbbbbbbbbbbbbbbbbbbbbbbb","unit_scale_source":"vrc-explorer-v1"},"mask_tier":"redacted","operation_id":"ebus.v1.snapshot.capture","operation_version":"git:520b6439441cb6e8ef9ff291bde28f4efa4db254","owner_commit":"e1962c0dc83836b0dbea129d198c7be6bea738da","owner_path":"protocols/vaillant/ebus-vaillant-B524.md","owner_repository":"Project-Helianthus/helianthus-docs-ebus","request_scope":{"operation_scope":"ebus-b524","phase":"action","source_kind":"EBUS"},"runtime_kind":"EBUS","runtime_pseudonym":"runtime-11111111111111111111111111111111","schema_sha256":"1002e09890801c9032548af407b13b58d889217dfc83e58bfe2a28df6bc33b78","snapshot_scope":{"mode":"SNAPSHOT","selector":"ebus-b524"},"source_contra